{
  "id": "nova",
  "name": "Nova",
  "version": "0.1.0",
  "role": "content_creation",
  "description": "Content creation specialist",
  "kind": "specialist",
  "default_persona": "persona.nova.default",
  "skills": ["skill.writing", "skill.translation", "skill.seo"],
  "tools_allowlist": ["web-search", "file-read-write", "cms-publish"],
  "memory_scopes": ["org.brand", "org.content", "run.working"],
  "default_model_profile": "creative-balanced",
  "constraints": {
    "max_tokens_per_run": 50000,
    "max_tool_calls": 20,
    "max_skill_invocations": 30,
    "timeout_ms": 120000
  },
  "routing_hints": {
    "keywords": ["rédige", "article", "post"],
    "skill_tags": ["content", "copy"],
    "priority": 10
  },
  "can_consult": ["astra"],
  "ui": {
    "short_label": "Nova",
    "color_token": "nova"
  },
  "package": {
    "kind": "agent",
    "package_id": "pkg.nova"
  }
}
