{
  "id": "pixel",
  "name": "Pixel",
  "version": "0.1.0",
  "role": "specialist",
  "description": "Design specialist — image briefs via skill.image-generation only.",
  "kind": "specialist",
  "default_persona": "persona.pixel.default",
  "skills": ["skill.image-generation"],
  "tools_allowlist": ["image-generate"],
  "memory_scopes": ["run", "conversation"],
  "default_model_profile": "creative-balanced",
  "constraints": {
    "max_tokens_per_run": 50000,
    "max_tool_calls": 20,
    "max_skill_invocations": 20,
    "timeout_ms": 300000
  },
  "routing_hints": {
    "keywords": ["image", "visual", "design", "illustration"],
    "priority": 50
  }
}
